{
  "id": "worldgen_home_island_v0_3",
  "name": "Worldgen Home Island v0.3",
  "version": "0.3.0",
  "kind": "worldgen_asset_pack",
  "masterManifest": "assets/generated/worldgen_v0_1/worldgen_asset_manifest_v0_1.json",
  "runtimeBindings": "assets/generated/worldgen_v0_1/runtime_bindings/rust_tilekind_mapping_v0_1.json",
  "biomeManifest": "assets/generated/worldgen_v0_1/home_island/home_island_biome_v0_1.json",
  "sceneContracts": [
    "content/worldgen/home_island_scene_contract_v0_1.json"
  ],
  "sceneFiles": [
    "content/worldgen/scenes/home_island/farmstead_scene_v0_3.json",
    "content/worldgen/scenes/home_island/north_road_scene_v0_3.json",
    "content/worldgen/scenes/home_island/south_field_scene_v0_3.json",
    "content/worldgen/scenes/home_island/east_woods_scene_v0_3.json",
    "content/worldgen/scenes/home_island/cave_mouth_scene_v0_3.json",
    "content/worldgen/scenes/home_island/tavern_interior_scene_v0_3.json",
    "content/worldgen/scenes/home_island/cellar_scene_v0_3.json",
    "content/worldgen/scenes/home_island/guest_floor_scene_v0_3.json",
    "content/worldgen/scenes/home_island/cave_depths_scene_v0_3.json"
  ],
  "worldSurface": "content/worldgen/home_island_world_surface_v0_3.json",
  "placementRules": "content/worldgen/home_island_placement_rules_v0_3.json",
  "autotileRules": "content/worldgen/autotile_rules_v0_3.json",
  "editorLayerRegistry": "content/worldgen/worldgen_editor_layer_registry_v0_3.json",
  "biomePalette": "content/worldgen/home_island_biome_palette_v0_3.json",
  "edgeBorderResolution": "content/worldgen/world_edge_border_resolution_v0_3.json",
  "islandTemplates": "content/worldgen/ten_island_style_templates_v0_3.json",
  "smokeTests": [
    "assets/generated/worldgen_v0_1/home_island/home_island_worldgen_smoke_test_v0_1.json",
    "content/worldgen/scenes/home_island/farmstead_scene_v0_3.json",
    "content/worldgen/scenes/home_island/north_road_scene_v0_3.json",
    "content/worldgen/scenes/home_island/south_field_scene_v0_3.json",
    "content/worldgen/scenes/home_island/east_woods_scene_v0_3.json",
    "content/worldgen/scenes/home_island/cave_mouth_scene_v0_3.json",
    "content/worldgen/scenes/home_island/tavern_interior_scene_v0_3.json",
    "content/worldgen/scenes/home_island/cellar_scene_v0_3.json",
    "content/worldgen/scenes/home_island/guest_floor_scene_v0_3.json",
    "content/worldgen/scenes/home_island/cave_depths_scene_v0_3.json"
  ],
  "previews": [
    "assets/generated/worldgen_v0_1/home_island/previews/home_island_scene_contact_sheet_v0_3.png"
  ],
  "editor": {
    "defaultScene": "farmstead",
    "defaultPreview": "assets/generated/worldgen_v0_1/home_island/previews/home_island_scene_contact_sheet_v0_3.png",
    "requiredPanels": [
      "Layer Stack",
      "Scene Outliner",
      "Footprint Inspector",
      "Validation Console",
      "Scene Edge Resolver"
    ]
  }
}
